{"compare_report_digest":"1010101010101010101010101010101010101010101010101010101010101010","expected_dataset_states":[{"dataset_id":"content","output":{"profile":"org.sqlite-capsule.dataset-state/1","row_count":4,"sha256":"4343434343434343434343434343434343434343434343434343434343434343"},"source":{"profile":"org.sqlite-capsule.dataset-state/1","row_count":4,"sha256":"4141414141414141414141414141414141414141414141414141414141414141"},"target":{"profile":"org.sqlite-capsule.dataset-state/1","row_count":4,"sha256":"4242424242424242424242424242424242424242424242424242424242424242"}},{"dataset_id":"preferences","output":{"profile":"org.sqlite-capsule.dataset-state/1","row_count":1,"sha256":"4545454545454545454545454545454545454545454545454545454545454545"},"source":{"profile":"org.sqlite-capsule.dataset-state/1","row_count":1,"sha256":"4444444444444444444444444444444444444444444444444444444444444444"},"target":{"profile":"org.sqlite-capsule.dataset-state/1","row_count":1,"sha256":"4545454545454545454545454545454545454545454545454545454545454545"}}],"lineage":{"details":{"ancestor_evidence":{"capsule_id":"fd48aa17-fb96-4716-97fc-0c40fd23ed2a","evidence_digest":"9fff18f419a0f6e8e9f25edad9e2723388f99d7a0b2976ff015034614a3d3e71","file_sha256":"5656565656565656565656565656565656565656565656565656565656565656","profile":"org.sqlite-capsule.reconcile-ancestor-evidence/1","revision_id":"fa0210e4-1d38-43ec-8a23-4a26e783b28e"},"compare_report_digest":"1010101010101010101010101010101010101010101010101010101010101010","operation_count":4,"payload_digest":"04fe9f6381457e94fb4f778a076a75dbc8d74d1361209b8d0e86e044eb141486","profile":"org.sqlite-capsule.reconcile-lineage-details/1","resolved_conflict_count":2},"event_id":"31fe41d2-35de-4ece-9200-c80061582c42","occurred_at":"2026-08-13T08:00:00Z","operation":"reconcile-to-copy","parents":[{"capsule_id":"fd48aa17-fb96-4716-97fc-0c40fd23ed2a","file_sha256":"5454545454545454545454545454545454545454545454545454545454545454","ordinal":1,"relation":"target-derived-from","revision_id":"b117c3ad-4205-43a9-b0d0-9d4f8dfa5734"},{"capsule_id":"8a89b412-32ec-49ec-9e61-bce3538fa8d2","file_sha256":"5151515151515151515151515151515151515151515151515151515151515151","ordinal":2,"relation":"changes-applied-from","revision_id":"39dd777e-f135-4ab0-8924-4c04570dde65"}],"result":{"capsule_id":"fd48aa17-fb96-4716-97fc-0c40fd23ed2a","revision_id":"b5eff64a-7244-46f1-b5d6-34735579eef6"}},"mode":"three-way","operations":[{"action":{"kind":"insert-source-row","source_write_set_digest":"2222222222222222222222222222222222222222222222222222222222222222"},"ancestor_state":{"state":"absent"},"basis":"three-way-clean","dataset_id":"content","key_digest":"2020202020202020202020202020202020202020202020202020202020202020","sequence":1,"source_state":{"row_digest":"2121212121212121212121212121212121212121212121212121212121212121","state":"present"},"table":"items","target_state":{"state":"absent"}},{"action":{"kind":"delete-target-row"},"ancestor_state":{"row_digest":"2424242424242424242424242424242424242424242424242424242424242424","state":"present"},"basis":"three-way-clean","dataset_id":"content","key_digest":"2323232323232323232323232323232323232323232323232323232323232323","sequence":2,"source_state":{"state":"absent"},"table":"items","target_state":{"row_digest":"2424242424242424242424242424242424242424242424242424242424242424","state":"present"}},{"action":{"kind":"replace-target-row-from-source","source_write_set_digest":"2929292929292929292929292929292929292929292929292929292929292929"},"ancestor_state":{"row_digest":"2828282828282828282828282828282828282828282828282828282828282828","state":"present"},"basis":"conflict-resolution","conflict_id":"45a358e14f4e31f2209170c1fa7548996be7600f0af69056f8ab693b3cd3eddc","dataset_id":"content","key_digest":"2525252525252525252525252525252525252525252525252525252525252525","sequence":3,"source_state":{"row_digest":"2626262626262626262626262626262626262626262626262626262626262626","state":"present"},"table":"items","target_state":{"row_digest":"2727272727272727272727272727272727272727272727272727272727272727","state":"present"}},{"action":{"fields":[{"column":"title","source_value_digest":"3333333333333333333333333333333333333333333333333333333333333333","target_value_digest":"3434343434343434343434343434343434343434343434343434343434343434"},{"column":"body","source_value_digest":"3535353535353535353535353535353535353535353535353535353535353535","target_value_digest":"3636363636363636363636363636363636363636363636363636363636363636"}],"kind":"set-target-fields-from-source"},"ancestor_state":{"row_digest":"3232323232323232323232323232323232323232323232323232323232323232","state":"present"},"basis":"three-way-clean","dataset_id":"content","key_digest":"3030303030303030303030303030303030303030303030303030303030303030","sequence":4,"source_state":{"row_digest":"3131313131313131313131313131313131313131313131313131313131313131","state":"present"},"table":"items","target_state":{"row_digest":"3232323232323232323232323232323232323232323232323232323232323232","state":"present"}}],"payload_digest":"04fe9f6381457e94fb4f778a076a75dbc8d74d1361209b8d0e86e044eb141486","profile":"org.sqlite-capsule.reconcile-payload/1","resolved_conflicts":[{"allowed_choices":["keep-target"],"ancestor_state":{"row_digest":"4040404040404040404040404040404040404040404040404040404040404040","state":"present"},"dataset_id":"content","id":"1e52edf5327445e567bdc1ae83b1db027c832fc9d54cb1d5419b82ef6aa5113f","key_digest":"3737373737373737373737373737373737373737373737373737373737373737","kind":"immutable-field","resolution":"keep-target","source_state":{"row_digest":"3838383838383838383838383838383838383838383838383838383838383838","state":"present"},"table":"items","target_state":{"row_digest":"3939393939393939393939393939393939393939393939393939393939393939","state":"present"}},{"allowed_choices":["keep-target","take-source"],"ancestor_state":{"row_digest":"2828282828282828282828282828282828282828282828282828282828282828","state":"present"},"dataset_id":"content","id":"45a358e14f4e31f2209170c1fa7548996be7600f0af69056f8ab693b3cd3eddc","key_digest":"2525252525252525252525252525252525252525252525252525252525252525","kind":"update-update","resolution":"take-source","source_state":{"row_digest":"2626262626262626262626262626262626262626262626262626262626262626","state":"present"},"table":"items","target_state":{"row_digest":"2727272727272727272727272727272727272727272727272727272727272727","state":"present"}}],"sensitive_confirmation":{"confirmed_dataset_ids":["content"],"required_dataset_ids":["content"]},"signature_inventories":{"ancestor":{"count":1,"sha256":"1313131313131313131313131313131313131313131313131313131313131313"},"source":{"count":1,"sha256":"1111111111111111111111111111111111111111111111111111111111111111"},"target":{"count":1,"sha256":"1212121212121212121212121212121212121212121212121212121212121212"}},"source_side":"source","target_side":"target"}